<?xml version="1.0" encoding="UTF-8"?><DataExplorerFileFormat xmlns:xsi="http://www.w3.org/2001/XMLSchema-instance" xsi:noNamespaceSchemaLocation="DataExplorerFileFormat_V02.xsd">	<VersionStamp>String</VersionStamp>	<CreationStamp>2010-01-01T09:00:00</CreationStamp>	<FileComment>String</FileComment>	<DeviceName>String</DeviceName>	<NumberOfRecordSets>1</NumberOfRecordSets>	<ObjectKey>String</ObjectKey>	<RecordSetDescription>		<RecordSetName>String</RecordSetName>		<Channel_Configuration/>		<RecordSetComment>String</RecordSetComment>		<RecordSetProperties>			<TimeStep_ms>3.141593E0</TimeStep_ms>			<TimeGridType>-0</TimeGridType>			<TimeGridLineStyle>LINE_SOLID</TimeGridLineStyle>			<TimeGridColor>				<Red>-0</Red>				<Green>-0</Green>				<Blue>-0</Blue>			</TimeGridColor>			<HorizontalGridRecord>String</HorizontalGridRecord>			<HorizontalGridType>-0</HorizontalGridType>			<HorizontalGridLineStyle>LINE_SOLID</HorizontalGridLineStyle>			<HorizontalGridColor>				<Red>-0</Red>				<Green>-0</Green>				<Blue>-0</Blue>			</HorizontalGridColor>		</RecordSetProperties>		<RecordProperties>			<Measurement>				<name>String</name>				<symbol>String</symbol>				<unit>String</unit>				<active>true</active>				<Property type="Integer" description="String" value="Text" name="String"/>				<Property type="Integer" description="String" value="Text" name="String"/>			</Measurement>			<DisplayProperties>				<isDisplayable>true</isDisplayable>				<isVisible>true</isVisible>				<maxValue>-0</maxValue>				<minValue>-0</minValue>				<defMaxValue>3.141593E0</defMaxValue>				<defMinValue>3.141593E0</defMinValue>				<isPositionLeft>true</isPositionLeft>				<color>					<Red>-0</Red>					<Green>-0</Green>					<Blue>-0</Blue>				</color>				<lineWidth>-0</lineWidth>				<lineStyle>LINE_SOLID</lineStyle>				<isRoundOut>true</isRoundOut>				<isStartpointZero>true</isStartpointZero>				<isStartEndDefined>true</isStartEndDefined>				<numberFormat>-0</numberFormat>			</DisplayProperties>		</RecordProperties>		<RecordDataSize>2147483647</RecordDataSize>		<RecordDataPointer>2147483647</RecordDataPointer>	</RecordSetDescription>	<RecordSetDataPoints>		<RecordDataArray>41394644363445313243</RecordDataArray>	</RecordSetDataPoints></DataExplorerFileFormat>